{
  "schema_version": "1.1",
  "frame_id": "BIF_BIRD_0041",
  "source": {
    "question_id": 41,
    "db_id": "california_schools",
    "question": "List the names of virtual schools that are among the top 5 in their respective counties based on average reading scores."
  },
  "lifecycle": {
    "state": "confirmed",
    "revision": 1,
    "confirmed_by": "oracle_user",
    "confirmed_at": null
  },
  "decision_objective": {
    "summary": "각 county에서 평균 읽기 점수가 가장 높은 virtual school 상위 5곳의 이름을 확인한다.",
    "intent_types": ["retrieve", "rank", "filter"]
  },
  "target_population": {
    "primary_entity": "school",
    "entity_description": "virtual school",
    "inclusion_conditions": [
      {
        "condition_id": "C1",
        "semantic_dimension": "school.delivery_mode",
        "subject": "school delivery type",
        "operator": "equals",
        "value_mode": "scalar",
        "set_relation": "not_applicable",
        "value": "exclusively virtual",
        "description": "교육 방식이 exclusively virtual인 학교"
      }
    ],
    "inclusion_logic": {
      "operator": "all_of",
      "condition_refs": ["C1"],
      "groups": []
    },
    "exclusion_conditions": [],
    "exclusion_logic": {
      "operator": "all_of",
      "condition_refs": [],
      "groups": []
    }
  },
  "metrics": [
    {
      "metric_id": "M1",
      "name": "average reading score",
      "definition": "학교의 평균 읽기 점수",
      "measure_kind": "attribute",
      "unit": "score"
    }
  ],
  "calculation": {
    "steps": [
      {
        "step_id": "CALC1",
        "operation": "rank",
        "description": "각 county 안에서 학교를 평균 읽기 점수의 내림차순으로 순위화한다.",
        "input_refs": ["M1", "county"],
        "output_ref": "county_reading_rank",
        "method": "descending rank within county"
      },
      {
        "step_id": "CALC2",
        "operation": "select",
        "description": "각 county에서 순위가 5위 이내인 학교를 선택한다.",
        "input_refs": ["county_reading_rank"],
        "output_ref": "selected_schools",
        "method": "rank at most 5"
      }
    ],
    "null_handling": null,
    "duplicate_handling": null
  },
  "granularity": {
    "input_unit": "one school with its average reading score",
    "output_unit": "one selected school",
    "dimensions": ["school", "county"]
  },
  "scope": {
    "grouping_dimensions": ["county"],
    "selections": [
      {
        "selection_id": "SEL1",
        "mode": "top_n",
        "target_ref": "M1",
        "within_dimensions": ["county"],
        "n": 5,
        "tie_policy": "include_all"
      }
    ]
  },
  "time_basis": {
    "mode": "not_applicable",
    "description": null,
    "periods": [],
    "temporal_semantics": "not_applicable",
    "cumulative": null
  },
  "comparisons": [],
  "output_expectation": {
    "shape": "detail_list",
    "fields": [
      {
        "field_id": "O1",
        "label": "school name",
        "semantic_ref": "selected_schools.school_name",
        "value_multiplicity": "single",
        "coverage": "one",
        "presentation": "single_column"
      }
    ],
    "ordering": [],
    "limit": null,
    "include_supporting_values": false
  },
  "assumptions": [
    {
      "assumption_id": "A1",
      "description": "Virtual school은 exclusively virtual school을 의미한다.",
      "material": true,
      "status": "confirmed",
      "affected_paths": ["/target_population/inclusion_conditions/0"]
    },
    {
      "assumption_id": "A2",
      "description": "공동 5위가 있으면 모두 포함한다.",
      "material": true,
      "status": "confirmed",
      "affected_paths": ["/scope/selections/0/tie_policy"]
    }
  ],
  "field_states": [
    {
      "path": "/decision_objective",
      "state": "explicit",
      "material": true,
      "note": null
    },
    {
      "path": "/target_population/inclusion_conditions/0",
      "state": "user_confirmed",
      "material": true,
      "note": "exclusively virtual definition confirmed"
    },
    {
      "path": "/scope/selections/0/within_dimensions",
      "state": "explicit",
      "material": true,
      "note": "respective counties"
    },
    {
      "path": "/scope/selections/0/tie_policy",
      "state": "user_confirmed",
      "material": true,
      "note": null
    }
  ],
  "readiness": {
    "state": "ready",
    "blocking_paths": [],
    "reason": null
  }
}
